{
  "schemaVersion": 1,
  "caseId": "navigation-sections",
  "responseSha256": "c363e31bb5fa3e03b0615df776fdbb4a8e196b27ed31ec847950537efc373cdc",
  "compilerOptionsSha256": "5a894821bf7692bd7e2cfb94da6ecc902ade4562dd11f33be49e8c507135ec9a",
  "typescriptVersion": "6.0.3",
  "packages": [
    {
      "name": "@kerfjs/ui",
      "version": "4.4.1",
      "declarationSetSha256": "fa4b755aa92b142c042baa837ae25f4dd2e638a456f6862a3c87991353c66c75"
    },
    {
      "name": "kerfjs",
      "version": "4.4.1",
      "declarationSetSha256": "6d0687d54c33813e12189b5d4dafe85947b0461f1630fa6028bc57febfa61fe0"
    }
  ],
  "compiledFiles": 1,
  "passed": true,
  "diagnostics": []
}
