{
  "schemaVersion": 1,
  "caseId": "workspace-states",
  "responseSha256": "55a614a657b735b522366e3ac0fa61e3856d47f33fc2ac7c51addcd50b58ea3e",
  "compilerOptionsSha256": "5a894821bf7692bd7e2cfb94da6ecc902ade4562dd11f33be49e8c507135ec9a",
  "typescriptVersion": "6.0.3",
  "packages": [
    {
      "name": "@kerfjs/ui",
      "version": "4.4.1",
      "declarationSetSha256": "fa4b755aa92b142c042baa837ae25f4dd2e638a456f6862a3c87991353c66c75"
    },
    {
      "name": "kerfjs",
      "version": "4.4.1",
      "declarationSetSha256": "6d0687d54c33813e12189b5d4dafe85947b0461f1630fa6028bc57febfa61fe0"
    }
  ],
  "compiledFiles": 1,
  "passed": false,
  "diagnostics": [
    {
      "code": 2322,
      "file": "response/ListWorkspace.tsx",
      "line": 34,
      "column": 17,
      "message": "Type '{ id: string; title: string; }' is not assignable to type 'PageHeaderProps'.\n  Property 'id' does not exist on type 'PageHeaderProps'."
    },
    {
      "code": 2322,
      "file": "response/ListWorkspace.tsx",
      "line": 36,
      "column": 29,
      "message": "Type '{ children: string; type: \"button\"; onClick: () => undefined; disabled: boolean; }' is not assignable to type 'HTMLButtonAttrs'.\n  Property 'onClick' does not exist on type 'HTMLButtonAttrs'."
    },
    {
      "code": 2322,
      "file": "response/ListWorkspace.tsx",
      "line": 42,
      "column": 51,
      "message": "Type '{ title: string; description: string; }' is not assignable to type 'StateBannerProps'.\n  Property 'description' does not exist on type 'StateBannerProps'."
    },
    {
      "code": 2322,
      "file": "response/ListWorkspace.tsx",
      "line": 44,
      "column": 31,
      "message": "Type '{ children: string; type: \"button\"; onClick: () => undefined; }' is not assignable to type 'HTMLButtonAttrs'.\n  Property 'onClick' does not exist on type 'HTMLButtonAttrs'."
    },
    {
      "code": 2322,
      "file": "response/ListWorkspace.tsx",
      "line": 47,
      "column": 74,
      "message": "Type '{ title: string; description: string; }' is not assignable to type 'EmptyStateProps'.\n  Property 'description' does not exist on type 'EmptyStateProps'."
    },
    {
      "code": 2322,
      "file": "response/ListWorkspace.tsx",
      "line": 47,
      "column": 143,
      "message": "Type '{ children: string; type: \"button\"; onClick: () => void; }' is not assignable to type 'HTMLButtonAttrs'.\n  Property 'onClick' does not exist on type 'HTMLButtonAttrs'."
    },
    {
      "code": 2322,
      "file": "response/ListWorkspace.tsx",
      "line": 48,
      "column": 68,
      "message": "Type '{ children: string; key: string; }' is not assignable to type 'HTMLLiAttrs'.\n  Property 'key' does not exist on type 'HTMLLiAttrs'."
    }
  ]
}
