{
  "schemaVersion": 1,
  "caseId": "compact-exclusive-choice",
  "responseSha256": "b106b34b3940757e1bdab1588f932bd98ff4213a28232242246ee850b6ad0801",
  "compilerOptionsSha256": "5a894821bf7692bd7e2cfb94da6ecc902ade4562dd11f33be49e8c507135ec9a",
  "typescriptVersion": "6.0.3",
  "packages": [
    {
      "name": "@kerfjs/ui",
      "version": "4.4.1",
      "declarationSetSha256": "fa4b755aa92b142c042baa837ae25f4dd2e638a456f6862a3c87991353c66c75"
    },
    {
      "name": "kerfjs",
      "version": "4.4.1",
      "declarationSetSha256": "6d0687d54c33813e12189b5d4dafe85947b0461f1630fa6028bc57febfa61fe0"
    }
  ],
  "compiledFiles": 1,
  "passed": false,
  "diagnostics": [
    {
      "code": 2322,
      "file": "response/WorkspaceViewChoice.tsx",
      "line": 7,
      "column": 136,
      "message": "Type '{ children: SafeHtml[]; key: \"board\" | \"list\" | \"timeline\"; }' is not assignable to type 'HTMLLabelAttrs'.\n  Property 'key' does not exist on type 'HTMLLabelAttrs'."
    },
    {
      "code": 2322,
      "file": "response/WorkspaceViewChoice.tsx",
      "line": 7,
      "column": 217,
      "message": "Type '{ type: \"radio\"; name: string; value: \"board\" | \"list\" | \"timeline\"; checked: boolean; onChange: () => void; }' is not assignable to type 'HTMLInputAttrs'.\n  Property 'onChange' does not exist on type 'HTMLInputAttrs'."
    }
  ]
}
