{
  "schemaVersion": 1,
  "caseId": "navigation-sections",
  "responseSha256": "926c3f671f19523ba11473412a0346c2cdd0d250a14211f51b59749154a97656",
  "compilerOptionsSha256": "5a894821bf7692bd7e2cfb94da6ecc902ade4562dd11f33be49e8c507135ec9a",
  "typescriptVersion": "6.0.3",
  "packages": [
    {
      "name": "@kerfjs/ui",
      "version": "4.4.1",
      "declarationSetSha256": "fa4b755aa92b142c042baa837ae25f4dd2e638a456f6862a3c87991353c66c75"
    },
    {
      "name": "kerfjs",
      "version": "4.4.1",
      "declarationSetSha256": "6d0687d54c33813e12189b5d4dafe85947b0461f1630fa6028bc57febfa61fe0"
    }
  ],
  "compiledFiles": 1,
  "passed": false,
  "diagnostics": [
    {
      "code": 2322,
      "file": "response/NavigationSidebar.tsx",
      "line": 9,
      "column": 130,
      "message": "Type '{ children: SafeHtml[]; key: string; \"aria-labelledby\": string; }' is not assignable to type 'KerfBaseAttrs'.\n  Property 'key' does not exist on type 'KerfBaseAttrs'."
    },
    {
      "code": 2322,
      "file": "response/NavigationSidebar.tsx",
      "line": 9,
      "column": 250,
      "message": "Type '{ children: SafeHtml; key: string; }' is not assignable to type 'HTMLLiAttrs'.\n  Property 'key' does not exist on type 'HTMLLiAttrs'."
    },
    {
      "code": 2322,
      "file": "response/NavigationSidebar.tsx",
      "line": 9,
      "column": 386,
      "message": "Type '{ children: SafeHtml[]; type: \"button\"; disabled: boolean | undefined; \"aria-current\": string | undefined; onClick: () => void; }' is not assignable to type 'HTMLButtonAttrs'.\n  Property 'onClick' does not exist on type 'HTMLButtonAttrs'."
    },
    {
      "code": 2322,
      "file": "response/NavigationSidebar.tsx",
      "line": 9,
      "column": 802,
      "message": "Type '{ children: string; type: \"button\"; onClick: () => void; }' is not assignable to type 'HTMLButtonAttrs'.\n  Property 'onClick' does not exist on type 'HTMLButtonAttrs'."
    },
    {
      "code": 2322,
      "file": "response/NavigationSidebar.tsx",
      "line": 9,
      "column": 854,
      "message": "Type '{ children: string; type: \"button\"; onClick: () => void; }' is not assignable to type 'HTMLButtonAttrs'.\n  Property 'onClick' does not exist on type 'HTMLButtonAttrs'."
    }
  ]
}
