{
  "schemaVersion": 1,
  "caseId": "tokenized-search",
  "responseSha256": "1e1ffaec719581e988b87c38ad42004d229f48c62f811a7e63cf391d33558cf4",
  "compilerOptionsSha256": "5a894821bf7692bd7e2cfb94da6ecc902ade4562dd11f33be49e8c507135ec9a",
  "typescriptVersion": "6.0.3",
  "packages": [
    {
      "name": "@kerfjs/ui",
      "version": "4.4.1",
      "declarationSetSha256": "fa4b755aa92b142c042baa837ae25f4dd2e638a456f6862a3c87991353c66c75"
    },
    {
      "name": "kerfjs",
      "version": "4.4.1",
      "declarationSetSha256": "6d0687d54c33813e12189b5d4dafe85947b0461f1630fa6028bc57febfa61fe0"
    }
  ],
  "compiledFiles": 1,
  "passed": false,
  "diagnostics": [
    {
      "code": 2322,
      "file": "response/TokenSearch.tsx",
      "line": 34,
      "column": 94,
      "message": "Type '{ children: SafeHtml[]; className: string; key: string; }' is not assignable to type 'KerfBaseAttrs'.\n  Property 'key' does not exist on type 'KerfBaseAttrs'."
    },
    {
      "code": 2322,
      "file": "response/TokenSearch.tsx",
      "line": 35,
      "column": 71,
      "message": "Type '{ children: string; type: \"button\"; \"aria-label\": string; onClick: () => void; }' is not assignable to type 'HTMLButtonAttrs'.\n  Property 'onClick' does not exist on type 'HTMLButtonAttrs'."
    },
    {
      "code": 2322,
      "file": "response/TokenSearch.tsx",
      "line": 36,
      "column": 73,
      "message": "Type '{ children: string; type: \"button\"; \"aria-label\": string; onClick: () => void; }' is not assignable to type 'HTMLButtonAttrs'.\n  Property 'onClick' does not exist on type 'HTMLButtonAttrs'."
    },
    {
      "code": 2322,
      "file": "response/TokenSearch.tsx",
      "line": 38,
      "column": 12,
      "message": "Type '{ ref: RefObject<HTMLInputElement | null>; id: string; type: \"text\"; role: string; \"aria-autocomplete\": string; \"aria-expanded\": boolean; \"aria-controls\": string | undefined; ... 6 more ...; onKeyDown: (event: any) => void; }' is not assignable to type 'HTMLInputAttrs'.\n  Property 'ref' does not exist on type 'HTMLInputAttrs'."
    },
    {
      "code": 7006,
      "file": "response/TokenSearch.tsx",
      "line": 40,
      "column": 17,
      "message": "Parameter 'event' implicitly has an 'any' type."
    },
    {
      "code": 7006,
      "file": "response/TokenSearch.tsx",
      "line": 41,
      "column": 18,
      "message": "Parameter 'event' implicitly has an 'any' type."
    },
    {
      "code": 2322,
      "file": "response/TokenSearch.tsx",
      "line": 48,
      "column": 74,
      "message": "Type '{ children: string; type: \"button\"; disabled: boolean; onClick: () => void; }' is not assignable to type 'HTMLButtonAttrs'.\n  Property 'onClick' does not exist on type 'HTMLButtonAttrs'."
    },
    {
      "code": 2322,
      "file": "response/TokenSearch.tsx",
      "line": 50,
      "column": 138,
      "message": "Type '{ children: string; key: string; id: string; role: string; \"aria-selected\": boolean; onMouseDown: (event: any) => any; onClick: () => void; }' is not assignable to type 'HTMLLiAttrs'.\n  Property 'key' does not exist on type 'HTMLLiAttrs'."
    },
    {
      "code": 7006,
      "file": "response/TokenSearch.tsx",
      "line": 50,
      "column": 255,
      "message": "Parameter 'event' implicitly has an 'any' type."
    }
  ]
}
