{
  "schemaVersion": 1,
  "caseId": "master-detail-dialog",
  "responseSha256": "047e7461086f81f438e12581161206d398018a6cbd881e9c6bf3f078e805118f",
  "compilerOptionsSha256": "5a894821bf7692bd7e2cfb94da6ecc902ade4562dd11f33be49e8c507135ec9a",
  "typescriptVersion": "6.0.3",
  "packages": [
    {
      "name": "@kerfjs/ui",
      "version": "4.4.1",
      "declarationSetSha256": "fa4b755aa92b142c042baa837ae25f4dd2e638a456f6862a3c87991353c66c75"
    },
    {
      "name": "kerfjs",
      "version": "4.4.1",
      "declarationSetSha256": "6d0687d54c33813e12189b5d4dafe85947b0461f1630fa6028bc57febfa61fe0"
    }
  ],
  "compiledFiles": 1,
  "passed": false,
  "diagnostics": [
    {
      "code": 2339,
      "file": "response/details.tsx",
      "line": 23,
      "column": 4,
      "message": "Property 'wa-dialog' does not exist on type 'JSX.IntrinsicElements'."
    },
    {
      "code": 2339,
      "file": "response/details.tsx",
      "line": 24,
      "column": 172,
      "message": "Property 'wa-button' does not exist on type 'JSX.IntrinsicElements'."
    },
    {
      "code": 2339,
      "file": "response/details.tsx",
      "line": 24,
      "column": 227,
      "message": "Property 'wa-button' does not exist on type 'JSX.IntrinsicElements'."
    },
    {
      "code": 2339,
      "file": "response/details.tsx",
      "line": 27,
      "column": 281,
      "message": "Property 'wa-button' does not exist on type 'JSX.IntrinsicElements'."
    },
    {
      "code": 2339,
      "file": "response/details.tsx",
      "line": 27,
      "column": 348,
      "message": "Property 'wa-button' does not exist on type 'JSX.IntrinsicElements'."
    },
    {
      "code": 2339,
      "file": "response/details.tsx",
      "line": 27,
      "column": 360,
      "message": "Property 'wa-button' does not exist on type 'JSX.IntrinsicElements'."
    },
    {
      "code": 2339,
      "file": "response/details.tsx",
      "line": 27,
      "column": 440,
      "message": "Property 'wa-button' does not exist on type 'JSX.IntrinsicElements'."
    },
    {
      "code": 2339,
      "file": "response/details.tsx",
      "line": 29,
      "column": 4,
      "message": "Property 'wa-dialog' does not exist on type 'JSX.IntrinsicElements'."
    }
  ]
}
